{
  "$schema": "../cmsc.schema.json",
  "articleDir": "./articles",
  "imageDir": "./images",
  "outputDir": "./output",
  "categories": [
    "commandline",
    "frontend",
    "backend",
    "infrastructure",
    "tool",
    "programming_contest"
  ],
  "tags": [
    "go",
    "python",
    "react",
    "nextjs",
    "vitejs",
    "electron",
    "docker"
  ],
  "r2": {
    "bucketName": "cms",
    "baseUrl": ""
  }
}
