{
  "$schema": "./cmsc.schema.json",
  "articleDir": "./content",
  "imageDir": "./images",
  "outputDir": "./dist",
  "categories": [
    "tech",
    "idea",
    "commandline"
  ],
  "tags": [
    "javascript",
    "typescript",
    "go",
    "python",
    "ansible",
    "react",
    "nextjs",
    "nodejs"
  ],
  "r2": {
    "endpoint": "https://<account_id>.r2.cloudflarestorage.com",
    "bucketName": "<your_bucket_name>",
    "baseUrl": "https://assets.your-domain.com"
  }
}
